{
  "$schema": "../core-compatibility.schema.json",
  "schema_version": 1,
  "core_id": "fake08",
  "publication": "disabled",
  "evidence_availability": "workspace-local-ignored",
  "golden_source": "pins/core-sets/fake08-814991a2571a-316c9d8894d9.json",
  "source_commit": "814991a2571ad3970e386cef48f3b148aa1c27b9",
  "e2e_run": ".local-e2e/runs/actions-sim-build-core-fake08-w3/e2e-record.json",
  "selected_e2e_content_sha256": "b1605adcf6766610ad38879cdc294a7e27e59cd56b4f511fa1f65425d197554f",
  "reproduction_run": ".local-e2e/runs/build-core-fake08-local-w3/e2e-record.json",
  "reproduction_e2e_content_sha256": "58c57eb78a1185e1cd5f074ed185aad0cd4e0ee219ad5c5b37564cd05ea6873c",
  "package_state": "reproducible",
  "package_sha256": "40c51465763d3ea18b01b756e1deb84ce2c243e99f17d4d330a582103e3b5324",
  "caveats": [
    "The publication-disabled simulated-Actions build-core run and the independent native-local build-core run reproduced the fake08_libretro.zip package, resolver metadata, both ABI artifacts, and both active-marker build logs byte for byte. Execution was local; both builds cloned the pinned source over the network, so no offline source cache is proven.",
    "This is static build/package evidence only. ARM64 is build-identity-bound to ra64-universal-v1 and ARMHF to ra32-a30-v1. ARMHF requires GLIBCXX_3.4.32, above the observed non-enforcing Miyoo Mini fallback provider value GLIBCXX_3.4.24, so the Mini profile is ineligible; A30 is the eligible 32-bit consumer at the ABI screen. Provider inspection and target-runtime capture are absent, so every execution profile and device view remains provisional and ineligible pending a runtime smoke result.",
    "Content, BIOS/firmware handling, controls, audio/video pacing, saves and state round trips, reset and unload behavior, frontend integration, compatibility, licensing review, and sustained performance remain target-runtime and human gates. Publication remains disabled regardless of local byte reproducibility."
  ],
  "targets": {
    "arm64": {
      "state": "local_static_build_golden",
      "validation_scope": "static-build-only",
      "runtime_validation": "needs-target-runtime",
      "artifact_sha256": "7933d89c25498f7417eca6eae62dbdafc4907bf425de6dd118cef1fbcc83ba0c",
      "elf": "ELF64/AArch64",
      "needed": [
        "ld-linux-aarch64.so.1",
        "libc.so.6",
        "libgcc_s.so.1",
        "libm.so.6",
        "libstdc++.so.6"
      ],
      "version_requirements": [
        "CXXABI_1.3",
        "CXXABI_1.3.9",
        "GCC_3.0",
        "GLIBCXX_3.4",
        "GLIBCXX_3.4.11",
        "GLIBCXX_3.4.14",
        "GLIBCXX_3.4.15",
        "GLIBCXX_3.4.19",
        "GLIBCXX_3.4.20",
        "GLIBCXX_3.4.21",
        "GLIBCXX_3.4.26",
        "GLIBCXX_3.4.9",
        "GLIBC_2.17",
        "GLIBC_2.27",
        "GLIBC_2.29"
      ]
    },
    "armhf": {
      "state": "local_static_build_golden",
      "validation_scope": "static-build-only",
      "runtime_validation": "needs-target-runtime",
      "artifact_sha256": "8d5cb2a01bd3bbce6f9053764dc3a744a2e0b18fa2ec978cb92c97a3e6fc6167",
      "elf": "ELF32/ARM hard-float",
      "needed": [
        "libc.so.6",
        "libgcc_s.so.1",
        "libm.so.6",
        "libstdc++.so.6"
      ],
      "version_requirements": [
        "CXXABI_1.3",
        "CXXABI_1.3.9",
        "CXXABI_ARM_1.3.3",
        "GCC_3.5",
        "GLIBCXX_3.4",
        "GLIBCXX_3.4.11",
        "GLIBCXX_3.4.14",
        "GLIBCXX_3.4.15",
        "GLIBCXX_3.4.19",
        "GLIBCXX_3.4.20",
        "GLIBCXX_3.4.21",
        "GLIBCXX_3.4.26",
        "GLIBCXX_3.4.29",
        "GLIBCXX_3.4.32",
        "GLIBCXX_3.4.9",
        "GLIBC_2.4"
      ]
    }
  },
  "content_sha256": "0bc2e46dd499f0a59681b01ff9589ebea90978643ebcdb421c065e94b659d01a"
}
