{
  "$schema": "../core-compatibility.schema.json",
  "schema_version": 1,
  "core_id": "gme",
  "publication": "disabled",
  "evidence_availability": "workspace-local-ignored",
  "golden_source": "pins/core-sets/gme-818629a9fbb9-55f6c02f68eb.json",
  "source_commit": "818629a9fbb9f99bd9c585395318834ae5c6434e",
  "e2e_run": ".local-e2e/runs/actions-sim-build-core-gme-w3/e2e-record.json",
  "selected_e2e_content_sha256": "4026c7c1aa1b33478ca7149291073f5ad1fe824c536979ba99737e6f5b3ba6ff",
  "reproduction_run": ".local-e2e/runs/build-core-gme-local-w3/e2e-record.json",
  "reproduction_e2e_content_sha256": "0ca8cb693fcda154a97ef6af5a65124523718dc156d1605e43394dbfc7bc7b03",
  "package_state": "reproducible",
  "package_sha256": "6400132c57ed305f43c41fab3bc295a1c823afccdaf740a6c0654e21c4aa9b89",
  "caveats": [
    "The publication-disabled simulated-Actions build-core run and the independent native-local build-core run reproduced the gme_libretro.zip package, resolver metadata, both ABI artifacts, and both active-marker build logs byte for byte. Execution was local; both builds cloned the pinned source over the network, so no offline source cache is proven.",
    "This is static build/package evidence only. ARM64 is build-identity-bound to ra64-universal-v1 and ARMHF to ra32-a30-v1. ARMHF's maximum GLIBCXX_3.4 is within the observed Miyoo Mini fallback provider ceiling GLIBCXX_3.4.24, so both the Mini and A30 profiles clear the ABI screen. Provider inspection and target-runtime capture are absent, so every execution profile and device view remains provisional and ineligible pending a runtime smoke result.",
    "Content, BIOS/firmware handling, controls, audio/video pacing, saves and state round trips, reset and unload behavior, frontend integration, compatibility, licensing review, and sustained performance remain target-runtime and human gates. Publication remains disabled regardless of local byte reproducibility."
  ],
  "targets": {
    "arm64": {
      "state": "local_static_build_golden",
      "validation_scope": "static-build-only",
      "runtime_validation": "needs-target-runtime",
      "artifact_sha256": "a3df3db6da9afb2526896f9fa873127c8c770fcabfb54d3de4254ca91fdcdd35",
      "elf": "ELF64/AArch64",
      "needed": [
        "ld-linux-aarch64.so.1",
        "libc.so.6",
        "libgcc_s.so.1",
        "libm.so.6",
        "libstdc++.so.6"
      ],
      "version_requirements": [
        "CXXABI_1.3",
        "CXXABI_1.3.9",
        "GCC_3.0",
        "GLIBCXX_3.4",
        "GLIBC_2.17",
        "GLIBC_2.29"
      ]
    },
    "armhf": {
      "state": "local_static_build_golden",
      "validation_scope": "static-build-only",
      "runtime_validation": "needs-target-runtime",
      "artifact_sha256": "7683ae5d7ed18b1ad661777c9f4060d9cad39ecee60a4b5ca1d2b555dff13d4c",
      "elf": "ELF32/ARM hard-float",
      "needed": [
        "libc.so.6",
        "libgcc_s.so.1",
        "libm.so.6",
        "libstdc++.so.6"
      ],
      "version_requirements": [
        "CXXABI_1.3",
        "CXXABI_1.3.9",
        "GCC_3.5",
        "GLIBCXX_3.4",
        "GLIBC_2.4",
        "GLIBC_2.7"
      ]
    }
  },
  "content_sha256": "d589ca619a243b0fdf2d24661f8abc0217d9fdc8e3e7262a68477b1aaacccceb"
}
