{
  "$schema": "../core-compatibility.schema.json",
  "schema_version": 1,
  "core_id": "swanstation",
  "publication": "disabled",
  "evidence_availability": "workspace-local-ignored",
  "golden_source": "pins/core-sets/swanstation-f901022198da-34adee359b68.json",
  "source_commit": "f901022198dacf125d43331c6540492441ab415b",
  "e2e_run": ".local-e2e/runs/actions-sim-build-core-swanstation-v1/e2e-record.json",
  "selected_e2e_content_sha256": "a1bcdff027321e13f88ae74411e794cc04f23d4793a393399d9df008f39cc875",
  "reproduction_run": ".local-e2e/runs/build-core-swanstation-local-v1/e2e-record.json",
  "reproduction_e2e_content_sha256": "b60f6ac0a6f89e972a07f7237ec88a68c1fadca7649a77d50629f97d9c825557",
  "package_state": "reproducible",
  "package_sha256": "cfd965c01a32d086e82fe16a7cb4b10bc63786f0ef793d3b9f998693d6b009de",
  "caveats": [
    "The publication-disabled simulated-Actions build-core run and the independent native-local build-core run reproduced the swanstation_libretro.zip package, resolver metadata, both ABI artifacts, and both active-marker build logs byte for byte. Execution was local; both builds cloned the pinned source over the network, so no offline source cache is proven.",
    "The armhf artifact has no libstdc++ dependency, so it clears every captured provider ceiling; ARM64 is bound to ra64-universal-v1 and ARMHF to ra32-a30-v1. Provider inspection and target-runtime capture are absent, so every device view remains provisional and ineligible pending a runtime smoke result.",
    "Content, BIOS/firmware handling, controls, audio/video pacing, saves and state round trips, reset and unload behavior, frontend integration, compatibility, licensing review, and sustained performance remain target-runtime and human gates. Publication remains disabled regardless of local byte reproducibility."
  ],
  "targets": {
    "arm64": {
      "state": "local_static_build_golden",
      "validation_scope": "static-build-only",
      "runtime_validation": "needs-target-runtime",
      "artifact_sha256": "4d6ae87490119367a8bda1d4253e8e4d3d6693bd6ee0223af7c61ee6a11f8efe",
      "elf": "ELF64/AArch64",
      "needed": [
        "ld-linux-aarch64.so.1",
        "libc.so.6",
        "libdl.so.2",
        "libgcc_s.so.1",
        "libm.so.6",
        "libpthread.so.0",
        "librt.so.1",
        "libstdc++.so.6"
      ],
      "version_requirements": [
        "CXXABI_1.3",
        "CXXABI_1.3.11",
        "CXXABI_1.3.5",
        "CXXABI_1.3.9",
        "GCC_3.0",
        "GCC_3.3.1",
        "GLIBCXX_3.4",
        "GLIBCXX_3.4.11",
        "GLIBCXX_3.4.14",
        "GLIBCXX_3.4.18",
        "GLIBCXX_3.4.20",
        "GLIBCXX_3.4.21",
        "GLIBCXX_3.4.22",
        "GLIBCXX_3.4.9",
        "GLIBC_2.17",
        "GLIBC_2.27",
        "GLIBC_2.29"
      ]
    }
  },
  "content_sha256": "fd8bd2ba0b5361e6f2e0be5d253b0eeae31fb45ff73feccb3d60028e491702dc"
}
