{
  "$schema": "../core-compatibility.schema.json",
  "schema_version": 1,
  "core_id": "frodo",
  "publication": "disabled",
  "evidence_availability": "workspace-local-ignored",
  "golden_source": "pins/core-sets/frodo-29dd1864b89d-4cface085a17.json",
  "source_commit": "29dd1864b89d903ed93f1d86d85636ef9e194359",
  "e2e_run": ".local-e2e/runs/actions-sim-build-core-frodo-v1/e2e-record.json",
  "selected_e2e_content_sha256": "65e4c5ce881b66f3cfb9bf0f4838e8a804d6fda05d3029606b33892cab504a38",
  "reproduction_run": ".local-e2e/runs/build-core-frodo-local-v1/e2e-record.json",
  "reproduction_e2e_content_sha256": "054965558332330fa0c4a61a6b8616fd9d0b2a7ed49fcffc0e83f36fccd4fbc1",
  "package_state": "reproducible",
  "package_sha256": "4afcd9d7788beef6c2104e061825feddccf096f9882be566b15d964a0e5d36cb",
  "caveats": [
    "The publication-disabled simulated-Actions build-core run and the independent native-local build-core run reproduced the frodo_libretro.zip package, resolver metadata, both ABI artifacts, and both active-marker build logs byte for byte. Execution was local; both builds cloned the pinned source over the network, so no offline source cache is proven.",
    "This is static build/package evidence only. ARM64 is build-identity-bound to ra64-universal-v1 and ARMHF to ra32-a30-v1. ARMHF's maximum GLIBCXX_3.4 is within the observed Miyoo Mini fallback provider ceiling GLIBCXX_3.4.24, so both the Mini and A30 profiles clear the ABI screen. Provider inspection and target-runtime capture are absent, so every execution profile and device view remains provisional and ineligible pending a runtime smoke result.",
    "Content, BIOS/firmware handling, controls, audio/video pacing, saves and state round trips, reset and unload behavior, frontend integration, compatibility, licensing review, and sustained performance remain target-runtime and human gates. Publication remains disabled regardless of local byte reproducibility."
  ],
  "targets": {
    "arm64": {
      "state": "local_static_build_golden",
      "validation_scope": "static-build-only",
      "runtime_validation": "needs-target-runtime",
      "artifact_sha256": "683834894465c267fe99351bad7a369409f6ed0a483b8fb6603684bf18ad87b1",
      "elf": "ELF64/AArch64",
      "needed": [
        "ld-linux-aarch64.so.1",
        "libc.so.6",
        "libgcc_s.so.1",
        "libm.so.6",
        "libstdc++.so.6"
      ],
      "version_requirements": [
        "CXXABI_1.3",
        "CXXABI_1.3.9",
        "GCC_3.0",
        "GLIBCXX_3.4",
        "GLIBC_2.17"
      ]
    },
    "armhf": {
      "state": "local_static_build_golden",
      "validation_scope": "static-build-only",
      "runtime_validation": "needs-target-runtime",
      "artifact_sha256": "f65a24c945fb375154afb033471439450f7fd343d36d4dddb0134887aa92249a",
      "elf": "ELF32/ARM hard-float",
      "needed": [
        "libc.so.6",
        "libgcc_s.so.1",
        "libm.so.6",
        "libstdc++.so.6"
      ],
      "version_requirements": [
        "CXXABI_1.3",
        "CXXABI_1.3.9",
        "GCC_3.5",
        "GLIBCXX_3.4",
        "GLIBC_2.4",
        "GLIBC_2.7"
      ]
    }
  },
  "content_sha256": "cce7e53009877795437a180eb234e3cfd6401e92d34055aa2d789447b4829d8e"
}
