{
  "$schema": "../core-compatibility.schema.json",
  "schema_version": 1,
  "core_id": "gearboy",
  "publication": "disabled",
  "evidence_availability": "workspace-local-ignored",
  "golden_source": "pins/core-sets/gearboy-36d723ff4410-f6f1b63e8798.json",
  "source_commit": "36d723ff44109e6d9eefba34e1c9a089c2d50e18",
  "e2e_run": ".local-e2e/runs/actions-sim-build-core-gearboy-v1/e2e-record.json",
  "selected_e2e_content_sha256": "522975c6948bc56356e736d85d4aa855e9e9ce7a893b46f424922938e0b41d4f",
  "reproduction_run": ".local-e2e/runs/build-core-gearboy-local-v1/e2e-record.json",
  "reproduction_e2e_content_sha256": "8e92533c9beb09740dd2543be5d2cf5c86ec9ac07a105a337d6e092ca97442e7",
  "package_state": "reproducible",
  "package_sha256": "05ebb30add0a597e7b8b9af9b4ba76f30821ee27b1abbd29b676e10e39f0f57c",
  "caveats": [
    "The publication-disabled simulated-Actions build-core run and the independent native-local build-core run reproduced the gearboy_libretro.zip package, resolver metadata, both ABI artifacts, and both active-marker build logs byte for byte. Execution was local; both builds cloned the pinned source over the network, so no offline source cache is proven.",
    "This is static build/package evidence only. ARM64 is build-identity-bound to ra64-universal-v1 and ARMHF to ra32-a30-v1. ARMHF requires GLIBCXX_3.4.32, above the observed non-enforcing Miyoo Mini fallback provider value GLIBCXX_3.4.24, so the Mini profile is ineligible; A30 is the eligible 32-bit consumer at the ABI screen. Provider inspection and target-runtime capture are absent, so every execution profile and device view remains provisional and ineligible pending a runtime smoke result.",
    "Content, BIOS/firmware handling, controls, audio/video pacing, saves and state round trips, reset and unload behavior, frontend integration, compatibility, licensing review, and sustained performance remain target-runtime and human gates. Publication remains disabled regardless of local byte reproducibility.",
    "The publication-disabled simulated-Actions build-core run and independent native-local build-core run reproduced the 393451-byte package, 1483-byte resolver metadata, both ABI artifacts, and both active-marker build logs byte for byte. Both profiles satisfy the exact singleton Gearboy source, 40-command mixed-language native-describe compile, ordered C++ link, source framing, success framing, and zero-diagnostic proof. Execution was local, but both builds cloned the pinned source over the network; no offline source cache is proven.",
    "The pristine source is commit 36d723ff44109e6d9eefba34e1c9a089c2d50e18, tree d01d828b1e5e7330bcf908b19b1afae8c9f8897b, with no submodules. Native git describe value 3.8.9-8-g36d723f occurs exactly once on each of one C and 39 C++ compile commands and never outside that compile scope. The proof binds every source/object pair, both ABI-specific compiler argv sets, and the exact ordered 40-object C++ link; both binaries expose version 3.8.9-8-g36d723f.",
    "Both ABIs contain no warnings, notes, errors, or fatal diagnostics. The proof binds the exact clone, detached-HEAD, native-version, toolchain, clean, compile, link, copy, and success sequence; source or Makefile mutation, compiler wrappers, response-file or shell indirection, malformed quoting, reordered framing, extra compiler commands, and altered link or completion arguments fail closed.",
    "Resolver metadata and the source license declare GPLv3. Metadata declares display version 3.4.1, gb|dmg|gbc|cgb|sgb content, deterministic save states, software rendering, and supports_no_game=false, while the compiled core exposes 3.8.9-8-g36d723f. Any public distribution or release remains a human legal and policy gate, and the version discrepancy requires operator review before publication. Publication remains disabled regardless of local byte reproducibility.",
    "The optional dmg_boot.bin and cgb_boot.bin boot ROMs have metadata MD5 values 32fbbd84168d3482956eb3c5051637f5 and dbfce9db9deaa2567f6a84fde55f9680; neither firmware file is packaged, and this evidence establishes no firmware redistribution rights. BIOS discovery, Game Boy, Game Boy Color and Super Game Boy content, controls, palettes and color correction, audio/video pacing, cheats, saves and state round trips, reset and unload behavior, frontend integration, compatibility, and sustained performance remain target-runtime gates.",
    "The software-only Unix recipe produces one shared artifact per ABI and provides no evidence for device-specific duplicate builds. ARM64 is build-identity-bound only to ra64-universal-v1; ARMHF is bound only to ra32-a30-v1. ARMHF requires GLIBCXX_3.4.32, above the observed non-enforcing Mini fallback provider value GLIBCXX_3.4.24. Provider inspection and target-runtime capture are absent, so all execution profiles and runtime compatibility claims remain provisional and every device view remains ineligible."
  ],
  "targets": {
    "arm64": {
      "state": "local_static_build_golden",
      "validation_scope": "static-build-only",
      "runtime_validation": "needs-target-runtime",
      "artifact_sha256": "7f0cab958e27e2f77e89d9b2a233d8c0c72b7c724815812d076dfd1edbb5ee86",
      "elf": "ELF64/AArch64",
      "needed": [
        "ld-linux-aarch64.so.1",
        "libc.so.6",
        "libm.so.6",
        "libstdc++.so.6"
      ],
      "version_requirements": [
        "CXXABI_1.3",
        "GLIBCXX_3.4",
        "GLIBCXX_3.4.15",
        "GLIBCXX_3.4.20",
        "GLIBCXX_3.4.21",
        "GLIBCXX_3.4.5",
        "GLIBCXX_3.4.9",
        "GLIBC_2.17",
        "GLIBC_2.27",
        "GLIBC_2.29"
      ]
    },
    "armhf": {
      "state": "local_static_build_golden",
      "validation_scope": "static-build-only",
      "runtime_validation": "needs-target-runtime",
      "artifact_sha256": "05e02b8aec79d8bca1fd586dc79765fc2393c3c190bd5d0b3f529284d6c336b3",
      "elf": "ELF32/ARM hard-float",
      "needed": [
        "libc.so.6",
        "libgcc_s.so.1",
        "libm.so.6",
        "libstdc++.so.6"
      ],
      "version_requirements": [
        "CXXABI_1.3",
        "GLIBCXX_3.4",
        "GLIBCXX_3.4.15",
        "GLIBCXX_3.4.20",
        "GLIBCXX_3.4.21",
        "GLIBCXX_3.4.32",
        "GLIBCXX_3.4.5",
        "GLIBCXX_3.4.9",
        "GLIBC_2.4"
      ]
    }
  },
  "content_sha256": "45001618ce4a689a588e51bcc9f44c2f459c583da8f384da7cf5600af5b2a6d2"
}
