{
  "$schema": "../core-compatibility.schema.json",
  "schema_version": 1,
  "core_id": "vice_x64",
  "publication": "disabled",
  "evidence_availability": "workspace-local-ignored",
  "golden_source": "pins/core-sets/vice_x64-7946cfa0d377-290256f3bebd.json",
  "source_commit": "7946cfa0d3775e958616d4d107de867a4616ae6c",
  "e2e_run": ".local-e2e/runs/actions-sim-build-core-vice_x64-v1/e2e-record.json",
  "selected_e2e_content_sha256": "791d8b9b80a2610eb1f42335cfc81fe9c2aea432462fb342ebc1575910ff70aa",
  "reproduction_run": ".local-e2e/runs/build-core-vice_x64-local-v1/e2e-record.json",
  "reproduction_e2e_content_sha256": "2e655e6e34ee6bfe7eb1106ae30e86a30af45ca447e7fe4b2c0fce38b6cf8d41",
  "package_state": "reproducible",
  "package_sha256": "b4d2474387eadda83cb71853be2a01b1486df0b54262dd2f4a647faf8df01f61",
  "caveats": [
    "The publication-disabled simulated-Actions build-core run and the independent native-local build-core run reproduced the vice_x64_libretro.zip package, resolver metadata, both ABI artifacts, and both active-marker build logs byte for byte. Execution was local; both builds cloned the pinned source over the network, so no offline source cache is proven.",
    "This is static build/package evidence only. ARM64 is build-identity-bound to ra64-universal-v1 and ARMHF to ra32-a30-v1. ARMHF's maximum GLIBCXX_3.4.21 is within the observed Miyoo Mini fallback provider ceiling GLIBCXX_3.4.24, so both the Mini and A30 profiles clear the ABI screen. Provider inspection and target-runtime capture are absent, so every execution profile and device view remains provisional and ineligible pending a runtime smoke result.",
    "Content, BIOS/firmware handling, controls, audio/video pacing, saves and state round trips, reset and unload behavior, frontend integration, compatibility, licensing review, and sustained performance remain target-runtime and human gates. Publication remains disabled regardless of local byte reproducibility.",
    "The publication-disabled simulated-Actions build-core run and the independent native-local build-core run reproduced the vice_x64_libretro.zip package, resolver metadata, both ABI artifacts, and both active-marker build logs byte for byte. Execution was local; both builds cloned the pinned source over the network, so no offline source cache is proven.",
    "This is static build/package evidence only. ARM64 is build-identity-bound to ra64-universal-v1 and ARMHF to ra32-a30-v1. ARMHF's maximum GLIBCXX_3.4.21 is within the observed Miyoo Mini fallback provider ceiling GLIBCXX_3.4.24, so both the Mini and A30 profiles clear the ABI screen. Provider inspection and target-runtime capture are absent, so every execution profile and device view remains provisional and ineligible pending a runtime smoke result.",
    "Content, BIOS/firmware handling, controls, audio/video pacing, saves and state round trips, reset and unload behavior, frontend integration, compatibility, licensing review, and sustained performance remain target-runtime and human gates. Publication remains disabled regardless of local byte reproducibility.",
    "The publication-disabled simulated-Actions build-core run and independent native-local build-core run reproduced the 2522812-byte package, metadata, and both ABI artifacts byte for byte. Parallel compilation changes whole-log ordering on both ABIs, but each selected/reproduction pair has the same exact line multiset and every log independently satisfies the singleton VICE x64 proof. Execution was local, but every build cloned its pinned source from GitHub and the current pipeline has no offline source cache.",
    "The pristine source is commit 7946cfa0d3775e958616d4d107de867a4616ae6c, tree db2760ffc97b9c20ef8777fcb7689082be66bc45, with no submodules. SOURCE_DATE_EPOCH 1780486798 binds the pinned commit time. The vice-x64-mixed-language-v1 contract proves exactly 564 native-version compiles (536 C and 28 C++), their exact semantic and ABI-specific invocation digests, no diagnostic lines, and the exact ordered link; parallel command-line ordering is compared as a fail-closed line multiset rather than as one incidental scheduler order.",
    "Resolver metadata declares GPLv2, display version 3.9, supports_no_game=true, needs_fullpath=true, disk control, serialized savestates, and libretro saves. The artifacts identify VICE x64 version 3.10 7946cfa0d3 and reproducibly embed build date 'Jun  3 2026' and time '11:39:58'. No source-license capture is present, so this record makes no broader source-license claim; public distribution or release remains a human legal and policy gate, and the metadata/runtime version discrepancy remains an integration gate.",
    "Base ROMs are embedded. Four optional JiffyDOS replacements are declared but not packaged: vice/JiffyDOS_C64.bin, vice/JiffyDOS_1541-II.bin, vice/JiffyDOS_1571_repl310654.bin, and vice/JiffyDOS_1581.bin. This evidence establishes no firmware redistribution rights. Built-in versus replacement firmware behavior and firmware discovery remain target-runtime gates.",
    "No-game startup, full-path content loading, C64 programs, cartridges, archives and playlists, disk and tape handling, disk-control operations, controller and keyboard behavior, save disks and libretro saves, serialized save states, audio and video pacing, frontend integration, compatibility, and sustained performance remain target-runtime gates.",
    "The software-only Unix recipe produces one shared artifact per ABI and provides no evidence for device-specific duplicate builds. ARM64 is build-identity-bound only to ra64-universal-v1; ARMHF is bound only to ra32-a30-v1. Provider inspection and target-runtime capture are absent, so every device view remains ineligible."
  ],
  "targets": {
    "arm64": {
      "state": "local_static_build_golden",
      "validation_scope": "static-build-only",
      "runtime_validation": "needs-target-runtime",
      "artifact_sha256": "2ec9bd7e0d9cdf35b43ff5e672c998fee10a79119a151b3f5d5c42f0c2d45121",
      "elf": "ELF64/AArch64",
      "needed": [
        "ld-linux-aarch64.so.1",
        "libc.so.6",
        "libgcc_s.so.1",
        "libm.so.6",
        "libstdc++.so.6"
      ],
      "version_requirements": [
        "CXXABI_1.3",
        "GCC_3.0",
        "GLIBCXX_3.4",
        "GLIBCXX_3.4.11",
        "GLIBCXX_3.4.21",
        "GLIBCXX_3.4.9",
        "GLIBC_2.17",
        "GLIBC_2.29"
      ]
    },
    "armhf": {
      "state": "local_static_build_golden",
      "validation_scope": "static-build-only",
      "runtime_validation": "needs-target-runtime",
      "artifact_sha256": "69061cfb98940f0a66200a214a477fb7545dc1a112018acf5aa02a9d07c0780a",
      "elf": "ELF32/ARM hard-float",
      "needed": [
        "libc.so.6",
        "libgcc_s.so.1",
        "libm.so.6",
        "libstdc++.so.6"
      ],
      "version_requirements": [
        "CXXABI_1.3",
        "CXXABI_ARM_1.3.3",
        "GCC_3.5",
        "GLIBCXX_3.4",
        "GLIBCXX_3.4.11",
        "GLIBCXX_3.4.21",
        "GLIBCXX_3.4.9",
        "GLIBC_2.4",
        "GLIBC_2.7"
      ]
    }
  },
  "content_sha256": "6f58666c8b2d17d958587c9aca1fa32aef61169d31921a0c120104c7f588e9c3"
}
