{
  "$schema": "../core-compatibility.schema.json",
  "schema_version": 1,
  "core_id": "mame2003_plus",
  "publication": "disabled",
  "evidence_availability": "workspace-local-ignored",
  "golden_source": "pins/core-sets/mame2003_plus-5373e38e1091-566e5d1cd54e.json",
  "source_commit": "5373e38e1091eb28f075513ecdc2575bafc8a5e3",
  "e2e_run": ".local-e2e/runs/actions-sim-build-core-mame2003_plus-v1/e2e-record.json",
  "selected_e2e_content_sha256": "31381654945eddb39295c163b1d64a113cecb899c0fd514f2abc140e7d47e989",
  "reproduction_run": ".local-e2e/runs/build-core-mame2003_plus-local-v1/e2e-record.json",
  "reproduction_e2e_content_sha256": "424d19335ecc21b4120fbc4076d787c6fa8687721594f249bb477803e01639d8",
  "package_state": "reproducible",
  "package_sha256": "bf93f1b543523298c788da7e5a6ee06e558f1d95f24a405f2aa7027cf4dc30b7",
  "caveats": [
    "The publication-disabled simulated-Actions build-core run and the independent native-local build-core run reproduced the mame2003_plus_libretro.zip package, resolver metadata, both ABI artifacts, and both active-marker build logs byte for byte. Execution was local; both builds cloned the pinned source over the network, so no offline source cache is proven.",
    "The armhf artifact has no libstdc++ dependency, so it clears every captured provider ceiling; ARM64 is bound to ra64-universal-v1 and ARMHF to ra32-a30-v1. Provider inspection and target-runtime capture are absent, so every device view remains provisional and ineligible pending a runtime smoke result.",
    "Content, BIOS/firmware handling, controls, audio/video pacing, saves and state round trips, reset and unload behavior, frontend integration, compatibility, licensing review, and sustained performance remain target-runtime and human gates. Publication remains disabled regardless of local byte reproducibility."
  ],
  "targets": {
    "arm64": {
      "state": "local_static_build_golden",
      "validation_scope": "static-build-only",
      "runtime_validation": "needs-target-runtime",
      "artifact_sha256": "753cf34208cc9805394b34bb500457f2edb4b92d9efaf51da29e4b4c5a6067fe",
      "elf": "ELF64/AArch64",
      "needed": [
        "ld-linux-aarch64.so.1",
        "libc.so.6",
        "libm.so.6"
      ],
      "version_requirements": [
        "GLIBC_2.17",
        "GLIBC_2.29"
      ]
    },
    "armhf": {
      "state": "local_static_build_golden",
      "validation_scope": "static-build-only",
      "runtime_validation": "needs-target-runtime",
      "artifact_sha256": "238f10a750c1e1e17b34ae05ca33ee9bd0167de5a7d2d36976e99702d10a076e",
      "elf": "ELF32/ARM hard-float",
      "needed": [
        "libc.so.6",
        "libm.so.6"
      ],
      "version_requirements": [
        "GLIBC_2.4"
      ]
    }
  },
  "content_sha256": "e805569233866e2174af4353aeaa300e20a704cd3c215488cebb93f0ad122cb3"
}
